{
    "$schema": "https://json-schema.org/draft/2019-09/schema",
    "$id": "https://github.com/vito-vrbic/OR-Laboratorij/blob/main/schema.json",
    "type": "array",
    "title": "Albums Dataset Schema",
    "description": "This schema represents a JSON array of album objects, each containing details about music albums.",
    "items": {
        "type": "object",
        "title": "Album",
        "description": "An object representing a music album.",
        "required": [
            "AlbumTitle",
            "ReleaseYear",
            "NumberOfSingles",
            "Genre",
            "Style",
            "ReleaseLabel",
            "Country",
            "Type",
            "Songs",
            "Producers",
            "Performers"
        ],
        "properties": {
            "AlbumTitle": {
                "type": "string",
                "title": "Album Title",
                "description": "The title of the album.",
                "examples": ["A Rainbow in Curved Air", "The Velvet Underground & Nico"]
            },
            "ReleaseYear": {
                "type": "integer",
                "title": "Release Year",
                "description": "The year the album was released.",
                "examples": [1969, 1967]
            },
            "NumberOfSingles": {
                "type": "integer",
                "title": "Number Of Singles",
                "description": "The number of singles released from the album.",
                "examples": [2]
            },
            "Genre": {
                "type": "string",
                "title": "Genre",
                "description": "The musical genre of the album.",
                "examples": ["Minimal", "Rock"]
            },
            "Style": {
                "type": "string",
                "title": "Style",
                "description": "The specific style or sub-genre of the album.",
                "examples": ["Minimal Ambient", "Experimental Rock"]
            },
            "ReleaseLabel": {
                "type": "string",
                "title": "Release Label",
                "description": "The record label that released the album.",
                "examples": ["Columbia Masterworks", "Verve Records"]
            },
            "Country": {
                "type": "string",
                "title": "Country Of Release",
                "description": "The country where the album was released.",
                "examples": ["United States of America"]
            },
            "Type": {
                "type": "string",
                "title": "Type",
                "description": "The type of album, e.g., studio album, live album.",
                "examples": ["Studio Album"]
            },
            "Songs": {
                "type": "array",
                "title": "Songs",
                "description": "A list of songs included in the album.",
                "items": {
                    "type": "object",
                    "title": "Song",
                    "description": "An object representing a song in the album.",
                    "required": ["SongTitle", "TrackNumber", "Duration"],
                    "properties": {
                        "SongTitle": {
                            "type": "string",
                            "title": "Song Title",
                            "description": "The title of the song.",
                            "examples": ["A Rainbow in Curved Air", "Sunday Morning"]
                        },
                        "TrackNumber": {
                            "type": "integer",
                            "title": "Track Number",
                            "description": "The track number of the song on the album.",
                            "examples": [1, 2]
                        },
                        "Duration": {
                            "type": "integer",
                            "title": "Duration",
                            "description": "The duration of the song in seconds.",
                            "examples": [1127, 173]
                        }
                    }
                }
            },
            "Producers": {
                "type": "array",
                "title": "Producers",
                "description": "A list of producers who worked on the album.",
                "items": {
                    "type": "object",
                    "title": "Producer",
                    "description": "An object representing a producer of the album.",
                    "required": ["ProducerArtistName", "ProducerFirstName", "ProducerLastName"],
                    "properties": {
                        "ProducerArtistName": {
                            "type": "string",
                            "title": "Producer's Artist Name",
                            "description": "The artist name of the producer.",
                            "examples": ["David Behrman", "The Velvet Underground"]
                        },
                        "ProducerFirstName": {
                            "type": ["string", "null"],
                            "title": "Producer's First Name",
                            "description": "The first name of the producer.",
                            "examples": ["David", null]
                        },
                        "ProducerLastName": {
                            "type": ["string", "null"],
                            "title": "Producer's Last Name",
                            "description": "The last name of the producer.",
                            "examples": ["Behrman", null]
                        }
                    }
                }
            },
            "Performers": {
                "type": "array",
                "title": "Performers",
                "description": "A list of performers who contributed to the album.",
                "items": {
                    "type": "object",
                    "title": "Performer",
                    "description": "An object representing a performer on the album.",
                    "required": ["PerformerArtistName", "PerformerFirstName", "PerformerLastName"],
                    "properties": {
                        "PerformerArtistName": {
                            "type": "string",
                            "title": "Performer's Artist Name",
                            "description": "The artist name of the performer.",
                            "examples": ["Terry Riley", "The Velvet Underground"]
                        },
                        "PerformerFirstName": {
                            "type": ["string", "null"],
                            "title": "Performer's First Name",
                            "description": "The first name of the performer.",
                            "examples": ["Terry", null]
                        },
                        "PerformerLastName": {
                            "type": ["string", "null"],
                            "title": "Performer's Last Name",
                            "description": "The last name of the performer.",
                            "examples": ["Riley", null]
                        }
                    }
                }
            }
        }
    }
}
