[
    {
        "AlbumTitle": "A Rainbow in Curved Air",
        "ReleaseYear": 1969,
        "NumberOfSingles": 2,
        "Genre": "Minimal",
        "Style": "Minimal Ambient",
        "ReleaseLabel": "Columbia Masterworks",
        "Country": "United States of America",
        "Type": "Studio Album",
        "Songs": [
            {
                "SongTitle": "A Rainbow in Curved Air",
                "TrackNumber": 1,
                "Duration": 1127
            },
            {
                "SongTitle": "Poppy Nogood and the Phantom Band",
                "TrackNumber": 2,
                "Duration": 1300
            }
        ],
        "Producers": [
            {
                "ProducerArtistName": "David Behrman",
                "ProducerFirstName": "David",
                "ProducerLastName": "Behrman"
            }
        ],
        "Performers": [
            {
                "PerformerArtistName": "Terry Riley",
                "PerformerFirstName": "Terry",
                "PerformerLastName": "Riley"
            }
        ]
    },
    {
        "AlbumTitle": "The Velvet Underground & Nico",
        "ReleaseYear": 1967,
        "NumberOfSingles": 2,
        "Genre": "Rock",
        "Style": "Experimental Rock",
        "ReleaseLabel": "Verve Records",
        "Country": "United States of America",
        "Type": "Studio Album",
        "Songs": [
            {
                "SongTitle": "Sunday Morning",
                "TrackNumber": 1,
                "Duration": 173
            },
            {
                "SongTitle": "I'm Waiting for the Man",
                "TrackNumber": 2,
                "Duration": 277
            },
            {
                "SongTitle": "Femme Fatale",
                "TrackNumber": 3,
                "Duration": 155
            },
            {
                "SongTitle": "Venus In Furs",
                "TrackNumber": 4,
                "Duration": 307
            },
            {
                "SongTitle": "Run Run Run",
                "TrackNumber": 5,
                "Duration": 258
            },
            {
                "SongTitle": "All Tomorrow's Parties",
                "TrackNumber": 6,
                "Duration": 355
            },
            {
                "SongTitle": "Heroin",
                "TrackNumber": 7,
                "Duration": 425
            },
            {
                "SongTitle": "There She Goes Again",
                "TrackNumber": 8,
                "Duration": 150
            },
            {
                "SongTitle": "I'll Be Your Mirror",
                "TrackNumber": 9,
                "Duration": 121
            },
            {
                "SongTitle": "The Black Angel's Death Song",
                "TrackNumber": 10,
                "Duration": 190
            },
            {
                "SongTitle": "European Son",
                "TrackNumber": 11,
                "Duration": 460
            }
        ],
        "Producers": [
            {
                "ProducerArtistName": "The Velvet Underground",
                "ProducerFirstName": null,
                "ProducerLastName": null
            },
            {
                "ProducerArtistName": "Andy Warhol",
                "ProducerFirstName": "Andy",
                "ProducerLastName": "Warhol"
            }
        ],
        "Performers": [
            {
                "PerformerArtistName": "The Velvet Underground",
                "PerformerFirstName": null,
                "PerformerLastName": null
            },
            {
                "PerformerArtistName": "Nico",
                "PerformerFirstName": "Christa",
                "PerformerLastName": "PÃ¤ffgen"
            }
        ]
    },
    {
        "AlbumTitle": "Bathing Beach",
        "ReleaseYear": 2017,
        "NumberOfSingles": 1,
        "Genre": "Indie Folk",
        "Style": "Ambient Folk",
        "ReleaseLabel": "AllPoints",
        "Country": "United Kingdom",
        "Type": "EP",
        "Songs": [
            {
                "SongTitle": "Carry You",
                "TrackNumber": 5,
                "Duration": 273
            },
            {
                "SongTitle": "Colourway",
                "TrackNumber": 6,
                "Duration": 228
            },
            {
                "SongTitle": "Anchor",
                "TrackNumber": 7,
                "Duration": 257
            },
            {
                "SongTitle": "Embody Me",
                "TrackNumber": 8,
                "Duration": 190
            }
        ],
        "Producers": [
            {
                "ProducerArtistName": "Novo Amor",
                "ProducerFirstName": "Ali",
                "ProducerLastName": "Lacey"
            }
        ],
        "Performers": [
            {
                "PerformerArtistName": "Novo Amor",
                "PerformerFirstName": "Ali",
                "PerformerLastName": "Lacey"
            }
        ]
    },
    {
        "AlbumTitle": "Stranger in the Alps",
        "ReleaseYear": 2017,
        "NumberOfSingles": 3,
        "Genre": "Indie Rock",
        "Style": "Sadcore",
        "ReleaseLabel": "Dead Oceans",
        "Country": "United States of America",
        "Type": "Studio Album",
        "Songs": [
            {
                "SongTitle": "Smoke Signals",
                "TrackNumber": 1,
                "Duration": 326
            },
            {
                "SongTitle": "Motion Sickness",
                "TrackNumber": 2,
                "Duration": 230
            },
            {
                "SongTitle": "Funeral",
                "TrackNumber": 3,
                "Duration": 232
            },
            {
                "SongTitle": "Demi Moore",
                "TrackNumber": 4,
                "Duration": 199
            },
            {
                "SongTitle": "Scott Street",
                "TrackNumber": 5,
                "Duration": 305
            },
            {
                "SongTitle": "Killer",
                "TrackNumber": 6,
                "Duration": 189
            },
            {
                "SongTitle": "Georgia",
                "TrackNumber": 7,
                "Duration": 247
            },
            {
                "SongTitle": "Chelsea",
                "TrackNumber": 8,
                "Duration": 282
            },
            {
                "SongTitle": "Would You Rather",
                "TrackNumber": 9,
                "Duration": 199
            },
            {
                "SongTitle": "You Missed My Heart",
                "TrackNumber": 10,
                "Duration": 417
            },
            {
                "SongTitle": "Smoke Signals (Reprise)",
                "TrackNumber": 11,
                "Duration": 36
            }
        ],
        "Producers": [
            {
                "ProducerArtistName": "Tony Berg",
                "ProducerFirstName": "Tony",
                "ProducerLastName": "Berg"
            }
        ],
        "Performers": [
            {
                "PerformerArtistName": "Phoebe Bridgers",
                "PerformerFirstName": "Phoebe",
                "PerformerLastName": "Bridgers"
            }
        ]
    },
    {
        "AlbumTitle": "blisters",
        "ReleaseYear": 2016,
        "NumberOfSingles": 0,
        "Genre": "R&B",
        "Style": "Gospel",
        "ReleaseLabel": "Tri Angle",
        "Country": "United States of America",
        "Type": "Studio Album",
        "Songs": [
            {
                "SongTitle": "Blisters",
                "TrackNumber": 1,
                "Duration": 409
            },
            {
                "SongTitle": "Flickering",
                "TrackNumber": 2,
                "Duration": 269
            },
            {
                "SongTitle": "Four Ethers",
                "TrackNumber": 3,
                "Duration": 269
            },
            {
                "SongTitle": "Penance",
                "TrackNumber": 4,
                "Duration": 167
            },
            {
                "SongTitle": "Redemption",
                "TrackNumber": 5,
                "Duration": 157
            }
        ],
        "Producers": [
            {
                "ProducerArtistName": "The Haxan Cloak",
                "ProducerFirstName": "Bobby",
                "ProducerLastName": "Krlic"
            }
        ],
        "Performers": [
            {
                "PerformerArtistName": "Serpentwithfeet",
                "PerformerFirstName": "Jonathan Josiah",
                "PerformerLastName": "White"
            }
        ]
    },
    {
        "AlbumTitle": "Mother Earth's Plantasia",
        "ReleaseYear": 1976,
        "NumberOfSingles": 0,
        "Genre": "Electronic",
        "Style": "Experimental",
        "ReleaseLabel": "Homewood Records",
        "Country": "United States of America",
        "Type": "Studio Album",
        "Songs": [
            {
                "SongTitle": "Plantasia",
                "TrackNumber": 1,
                "Duration": 201
            },
            {
                "SongTitle": "Symphony For A Spider Plant",
                "TrackNumber": 2,
                "Duration": 160
            },
            {
                "SongTitle": "Baby's Tears Blues",
                "TrackNumber": 3,
                "Duration": 181
            },
            {
                "SongTitle": "Ode To An African Violet",
                "TrackNumber": 4,
                "Duration": 241
            },
            {